,hashtag,tweet_id,image_path,body_text,text_with_OCR
0,CoronaHoax,1232663336111759361,./tweet_data/vaccine_2020-02/CoronaHoax/tweets4/ERtLeI7W4AEBRx6.jpg,"@ajayfromthebay The Gov. has a cure.⚗️🧪💊💉for its own diseases.
You should see the Bigger picture of this puzzle.
Problem =&gt; Reaction =&gt; Solution
#CoronaHoax=#Vaccination=#Depopulation https://t.co/MeltrPOAT5",big pharma wv rig ant ee org ge ne eis ad ee oe ee es sickness profit
1,antivax,1225248510049693696,./tweet_data/vaccine_2020-02/antivax/tweets1/EQD1BsOW4AED9Os.jpg,"You can't get autism if you die from polio.
#Antivax https://t.co/DnWV2hRBBK",cant autism die polio
2,antivax,1225437363071016961,./tweet_data/vaccine_2020-02/antivax/tweets1/EQGgyboWoAUs68d.png,“GET VACCINATED” via u/The_Heirophant_5 #vaxxhappened #antivax #antivaxx https://t.co/D6I86tvQyl,unvaccinated kid breathe smallpox mumps measle tetanu flu dangerous leave alive
3,antivax,1225090066000891906,./tweet_data/vaccine_2020-02/antivax/tweets1/EQBk7EsWoAcn-PK.jpg,"“Also, 3-year-old baby?” via u/anoobsearcher #vaxxhappened #antivax #antivaxx https://t.co/LbP3pbgHOs",ase clee ee pee like share baby year old travel thailand past week fear econ es erb
4,antivax,1225482684710957059,./tweet_data/vaccine_2020-02/antivax/tweets1/EQHKAfKXsAIB7dl.jpg,““I’ve done my research”” via u/ApprehensiveEnd #vaxxhappened #antivax #antivaxx https://t.co/PaZaf2ILvz,year medical research prove effectiveness vaccination western medicine wel kaen ra
5,antivax,1224182208413544448,./tweet_data/vaccine_2020-02/antivax/tweets1/EP0rOsNX0AEWwyu.jpg,"Tomorrow is the first day of our Black History Week! To kick the week off, we are having professional blackfacers showing our African kids how to step dance!! #antivax #RosaParks #BlackFace https://t.co/jogQT1i2nd",naw ay rosa parks te oo
6,antivax,1224401791971921920,./tweet_data/vaccine_2020-02/antivax/tweets1/EP3y8QyX4AAHaY-.jpg,“Disappointment at its best” via u/Iambutteredtoast #vaxxhappened #antivax #antivaxx https://t.co/KOza1tEGUF,atat cs 914 80 pr fertility regulate vaccine test india cl ao fi
7,antivax,1224039359411838984,./tweet_data/vaccine_2020-02/antivax/tweets1/EPypT6SWkAETCiz.jpg,“*SERIOUS* [Reposted from r/Veryfuckingstupid]” via u/MicroFlamer #vaxxhappened #antivax #antivaxx https://t.co/9Jc0MQLjFY,ts yh od 1d cla ma gon na die slow painful death eerie fe la na ey ra like ti
8,antivax,1223589926010327041,./tweet_data/vaccine_2020-02/antivax/tweets1/EPsQjbbX4AESgCM.jpg,“that isn’t... strawmanning doesn’t help prove... why bother?” via u/westcoastsmokers #vaxxhappened #antivax #antivaxx https://t.co/6PjspvHvPE,acer vaccines ree need censor wrong
9,antivax,1223750364962230272,./tweet_data/vaccine_2020-02/antivax/tweets1/EPuieBbVUAA2OX7.jpg,Can’t wait to mold my babies brain and teach him what the system won’t 💯 #HolisticBaby #AntiVax #Vegan @_brittneyluker https://t.co/xvsV2vJr1n,yen nw ov oe lt ae atop bs lop patel sae pu nn
10,antivax,1223513223313399808,./tweet_data/vaccine_2020-02/antivax/tweets1/EPrKydUX0AcNGj7.jpg,"To be fair to the toddlers in the room, even most of them know essential oils are bullshit.
#antivaxx #antivax #VaccinesWork https://t.co/xZ3uGMkLEj",want kill impossible reason go lot tle ramble take bath monologue toddler
11,antivax,1223861678707703808,./tweet_data/vaccine_2020-02/antivax/tweets1/EPwHth8WoAAuZBW.jpg,“Please vaccinate” via u/thebobapaul #vaxxhappened #antivax #antivaxx https://t.co/oroMRsMfIi,os ms pev ese death
12,antivax,1223861673657847808,./tweet_data/vaccine_2020-02/antivax/tweets1/EPwHtOnWAAAHetM.jpg,“At our local maui swap meet” via u/SLASHERDASHER1 #vaxxhappened #antivax #antivaxx https://t.co/ADvUaUAt1u,os iy oo bates ge volcanic healing crystal
13,antivax,1223695603525439488,./tweet_data/vaccine_2020-02/antivax/tweets1/EPtwqrhXkAAh0E_.jpg,“And her colloid silver” via u/cayce_leighann #vaxxhappened #antivax #antivaxx https://t.co/NaA0W3yL63,fs ea th ry ie fe col ing yr karen lavender essential gil vi
14,antivax,1223710655892594688,./tweet_data/vaccine_2020-02/antivax/tweets1/EPt-W2MWkAAVzCr.jpg,"“My boss’ mug at my part time job, I work in a pharmacy lmaooooo” via u/imsochoofed #vaxxhappened #antivax #antivaxx https://t.co/GdiZjwiasQ",aia aoa tec sas ras gr perce fe sat
15,antivax,1223803141747040256,./tweet_data/vaccine_2020-02/antivax/tweets1/EPvSd8EX4AAMRZR.png,Just gonna leave this here #antivax #coronovirus https://t.co/iAn95xcOWz,ony yi fe come karen lavender essential gil ae
16,antivax,1223937141295779840,./tweet_data/vaccine_2020-02/antivax/tweets1/EPxMWB5X4AApD6L.jpg,“I love democracy” via u/schrocks #vaxxhappened #antivax #antivaxx https://t.co/dJ9unF5a3Z,antivax parent charge child abuse yes 99 oo en love democracy
17,antivax,1227784084690096128,./tweet_data/vaccine_2020-02/antivax/tweets2/EQn3HcEVUAAyZVc.jpg,Woops 😲.  #coronarovirus #antivax https://t.co/XAz9frc7iZ,dear antivaxxer chance china prove di
18,antivax,1227780902979330048,./tweet_data/vaccine_2020-02/antivax/tweets2/EQn0OGmXkAUSYhy.jpg,"Just do it... 
#antivaxx #antivax #VaccinesSaveLives https://t.co/lTGEh9J7g9",dear antivaxxer chance china prove wrong
19,antivax,1227755858622373888,./tweet_data/vaccine_2020-02/antivax/tweets2/EQndcnFWoAEXk2q.jpg,"“As a vaccine advocate, lots of Antivaxxers request interviews. Here’s how to respond” via u/ethanlindenberger #vaxxhappened #antivax #antivaxx https://t.co/QgHvosx8iz",willing speak nonmainstream journalist journey possible speak mother important media od ul ethan joseph reply nah
20,antivax,1227725526284021761,./tweet_data/vaccine_2020-02/antivax/tweets2/EQnB2yyXYAADhcT.jpg,"How the #antivax #antivaxxers are goons screw over the rest of the world that’s trying to survive the COVID-19 outbreak. 

(Not my meme. Don’t know the original creator unfortunately.) https://t.co/WCLDiqtmJb",cm ls coro anit ane ee eat et
21,antivax,1227958423498551296,./tweet_data/vaccine_2020-02/antivax/tweets2/EQqVRL0UUAIMP4y.jpg,"I hope we're not wrong.

#safe #antivirus #antivax #geeksforgeeks #dailygadi https://t.co/BQ3tensx1s",dear antivaxxer chance china prove wrong ae
22,antivax,1227952120437055490,./tweet_data/vaccine_2020-02/antivax/tweets2/EQqP74-XsAAQe7z.jpg,"Vaccination is NOT a myth !
Vaccination is effective in preventing disease !! 

#coronavirus #CoronaOutbreak #epidemiacoronavirus #CoronaVirusFacts  #VaccinesSaveLives #vaccination #VaccinesWork #thursdaymorning 
#ThursdayThoughts #antivaxx #antivax #antivaxxers #dontbeahero 😂 https://t.co/r8eWXpniiR",dear antivaxxer chance china je coe te wrong ma
23,antivax,1227996864789786624,./tweet_data/vaccine_2020-02/antivax/tweets2/EQq4o3ZXYAE1DY2.jpg,I’m just gonna leave this right here. #antivax https://t.co/TMD7KUOiUx,dear antivaxxer chance china prove wrong
24,antivax,1228064768876937216,./tweet_data/vaccine_2020-02/antivax/tweets2/EQr2ZPVVUAALoc3.jpg,Time to shine #antivax clowns! 🦠 #antivaxx https://t.co/cenqw3BeQP,dear antivaxxer chance china prove ahha ul
25,antivax,1227909872450252801,./tweet_data/vaccine_2020-02/antivax/tweets2/EQpphPKWAAQLSUW.jpg,⁦I think this does provide a unique opportunity to provide valid research! @ProAntiVaxxer⁩ #antivaxx #antivax #antivaxxers https://t.co/UWnSL7xsrn,cc dear antivaxxer chance china prove wrong el
26,antivax,1227974806282424321,./tweet_data/vaccine_2020-02/antivax/tweets2/EQqklC_XsAE9Fd6.jpg,“After finding a meme from r/dankmemes on the karen group for vaccines they decided to edit it...poor spidey they cannot even use photoshop right” via u/dippyfreshdawg #vaxxhappened #antivax #antivaxx https://t.co/upkx6wURtv,ae dear chance china prove
27,antivax,1227974616599158791,./tweet_data/vaccine_2020-02/antivax/tweets2/EQqkZ-_WkAE7FJs.jpg,Well ..go on then ..#antivax https://t.co/qCV23OAtd1,dear antivaxxer chance china prove heal oi
28,antivax,1227948469727350784,./tweet_data/vaccine_2020-02/antivax/tweets2/EQqMjVkVAAYYQ8o.jpg,Hey #antivax folk https://t.co/fWcqMUKmWI,dear antivaxxer chance china prove wrong uf
29,antivax,1227536942096670720,./tweet_data/vaccine_2020-02/antivax/tweets2/EQkWV3iXsAEXPdC.jpg,“Thanks Bill!” via u/j0an_k #vaxxhappened #antivax #antivaxx https://t.co/1FLKqRJyz8,ae bill gates explain vaccine work bill gates 234 121
30,antivax,1227310448401317891,./tweet_data/vaccine_2020-02/antivax/tweets2/EQhIWWFXsAA8LLU.jpg,“On a thread about a Coronavirus vaccine. (Herbal remedies will not cure coronavirus)” via u/Mojoblackwhite #vaxxhappened #antivax #antivaxx https://t.co/zl6Qz0KMOM,reply bet god cure prevention 1657 twitter web app 31 like
31,antivax,1227152131217596417,./tweet_data/vaccine_2020-02/antivax/tweets2/EQe4XFZX0AUtmSS.jpg,“Another death because of stupidness” via u/jjsh354 #vaxxhappened #antivax #antivaxx https://t.co/AuOdAssstF,rs die flu mom seek advice antivax facebook group day ago
32,antivax,1227597272977936386,./tweet_data/vaccine_2020-02/antivax/tweets2/EQlNNvXXYAEjZQN.jpg,“Gotta catch ‘em all!” via u/Will87_fghs #vaxxhappened #antivax #antivaxx https://t.co/SjxHRI93Lg,fun new mobile game anti tasks catch 150 disease 57k share cay nona oe ao
33,antivax,1227103499193896966,./tweet_data/vaccine_2020-02/antivax/tweets2/EQeMIUhXUAcZgFr.jpg,#vax #antivax found this gem on the web today.  People are funny AF https://t.co/eJZfifTnd9 https://t.co/XUrkbKAtH7,aro 0l en mn aco amm ela laos computer ae aed hy ve
34,antivax,1226548096059965441,./tweet_data/vaccine_2020-02/antivax/tweets2/EQWS_mTXsAQdUwX.jpg,“She should be scared” via u/Jeremymf0 #vaxxhappened #antivax #antivaxx https://t.co/FDV4U7yLo5,co try think lea scary thing fg measle ed co rn baris rae hh fl ww
35,antivax,1227152107846950919,./tweet_data/vaccine_2020-02/antivax/tweets2/EQe4VuQXUAA1EcS.jpg,"“Uh oh, found one in the wild” via u/Iamabushaha #vaxxhappened #antivax #antivaxx https://t.co/MJRA2UEmn5",rf aww en ll 162d dad get pretend vaccinate daughter scared needle aww 162d come vax circlejerk
36,antivax,1226193288673316865,./tweet_data/vaccine_2020-02/antivax/tweets2/EQRQTC9WoAADHzV.jpg,“This person would rather have dead children than living children” via u/anoobsearcher #vaxxhappened #antivax #antivaxx https://t.co/d9JmslHT6p,verizon 9216 laughs qi face hear zombie mom say child autism die see 11 reruns
37,antivax,1226442488958869505,./tweet_data/vaccine_2020-02/antivax/tweets2/EQUy8cqWkAANr67.jpg,“Woman dresses as Measels for Halloween. Nurse murders her in the comments” via u/Sarcastic_Troll #vaxxhappened #antivax #antivaxx https://t.co/h2HMlPYHiE,rr try think lea scary thing fg measle ed cn
38,antivax,1229947516751417347,./tweet_data/vaccine_2020-02/antivax/tweets3/ERGmv7dW4AECXt5.jpg,“Spotted in Toronto” via u/useless_grape #vaxxhappened #antivax #antivaxx https://t.co/UJgxaOfhEn,od vee zl fo vaccine yo tor th ei tn wen lena sere
39,antivax,1230075887976099840,./tweet_data/vaccine_2020-02/antivax/tweets3/ERIbgHbW4AEBV9z.jpg,“I mean-” via u/EmeraldB16 #vaxxhappened #antivax #antivaxx https://t.co/PsVZrfaHFE,day ago people antivax population control add public reply ree ka uay ago call bastard 1o
40,antivax,1230106049887248384,./tweet_data/vaccine_2020-02/antivax/tweets3/ERI27w5WkAA3eMi.jpg,“Shared on Facebook!” via u/neildrill #vaxxhappened #antivax #antivaxx https://t.co/GllJSibfZP,0000 18 ort ag memo ih th gm qe agn uu nw give aa te inte evn edie
41,antivax,1230196734929838081,./tweet_data/vaccine_2020-02/antivax/tweets3/ERKJaUpWAAA--SG.jpg,“Pro vax mom and anti vax child” via u/anoobsearcher #vaxxhappened #antivax #antivaxx https://t.co/xTigGLP891,phi immune system ue yy aye px whe vaccines needed or mom tcr etm ae lu ial
42,antivax,1230257035087958016,./tweet_data/vaccine_2020-02/antivax/tweets3/ERLAQNvXkAAKLYr.png,"“""smart""” via u/EatingYourForskinUwO #vaxxhappened #antivax #antivaxx https://t.co/XCdKWKEr9U",ti fe ru emt fully xn ed ne ay vulnerable victorians duc
43,antivax,1229940044418441216,./tweet_data/vaccine_2020-02/antivax/tweets3/ERGf8-eWsAUU1cN.jpg,“Thought this belonged here” via u/destination66 #vaxxhappened #antivax #antivaxx https://t.co/pPDMgySvLt,dear antivaxxer chance china prove hele ch aa nn ee
44,antivax,1230118529715843072,./tweet_data/vaccine_2020-02/antivax/tweets3/ERJCQ2lXkAE7GG8.jpg,#antivax just saying https://t.co/IgQn18n28J,ae dear antivaxxer chance china prove wrong
45,antivax,1230077084048994304,./tweet_data/vaccine_2020-02/antivax/tweets3/ERIclWmWoAAybtw.jpg,"Made me really laugh!
#Coronavirius #antivax https://t.co/hZqXQKEfi1",dear antivaxxer chance china prove eee ul
46,antivax,1230189156086751232,./tweet_data/vaccine_2020-02/antivax/tweets3/ERKChMIWkAEwtB-.jpg,“Most adults of unvaxxed children are vaxxed” via u/UnwilledMars #vaxxhappened #antivax #antivaxx https://t.co/2uvD1zWMuw,ar ph immune system vy ex ho vaccines weeded post reddit
47,antivax,1229804111320748037,./tweet_data/vaccine_2020-02/antivax/tweets3/EREkUnJWAAclCIr.jpg,“Anti-Vaxxers and their ‘research’” via u/wandlore #vaxxhappened #antivax #antivaxx https://t.co/lrq6siuEz6,mom look hundred article link autism show se mom seein pinterest meme say dangerous
48,antivax,1229819178896502784,./tweet_data/vaccine_2020-02/antivax/tweets3/EREyBptX0AIcohb.jpg,"“Earth shattering news: ""Vaccines can prevent fatal complications from measles, study affirms""” via u/SandyJ8 #vaxxhappened #antivax #antivaxx https://t.co/KfMfRw4arl",oa ea ae lt evict cory ea leu ere sh lala er ao
49,antivax,1229841856822947842,./tweet_data/vaccine_2020-02/antivax/tweets3/ERFGpsfWoAEv55d.jpg,“Title should instead be “I shouldn’t work in healthcare or be a nurse at all.”” via u/Ssylphie #vaxxhappened #antivax #antivaxx https://t.co/ENbYX232Zr,nurse vaccine guise rt lt lad 226 live chat share dow tv subscribe 681 subscriber
50,antivax,1229532264423358464,./tweet_data/vaccine_2020-02/antivax/tweets3/ERAtFDLXsAAE96m.jpg,“I don’t even know what to say” via u/FBI_IRL #vaxxhappened #antivax #antivaxx https://t.co/2gt97y4qxI,19 min gender confusion link male female aborted fetal cell find childhood vaccine 103 90 comment share
51,antivax,1229458816770695170,./tweet_data/vaccine_2020-02/antivax/tweets3/EQ_p8LHWAAApZ6s.jpg,This is witty. #antivaxxers #antivax https://t.co/eu4Rb697D7,dear antivaxxer chance china prove el oi fi joi
52,antivax,1228748930806095872,./tweet_data/vaccine_2020-02/antivax/tweets3/EQ1kpCNWAAAXrp3.jpg,“Soooooo Goopey” via u/mbhammock #vaxxhappened #antivax #antivaxx https://t.co/gYSLoyKqaE,try use western medicine bae essential oil jade egg ay ai
53,antivax,1229164703311515648,./tweet_data/vaccine_2020-02/antivax/tweets3/EQ7eyDKVAAAbzE5.jpg,Hey. I will admit I'm wrong if you pull this off! #antivax #VaccinesWork #vaccinateyourkids #readabook #science https://t.co/PSZgVjxIym,dear antivaxxer chance china prove wrong
54,antivax,1229133963526053888,./tweet_data/vaccine_2020-02/antivax/tweets3/EQ7C03tWoAE6H8H.png,“*Spoiler alert* it's not the infant” via u/Lack39 #vaxxhappened #antivax #antivaxx https://t.co/tOUvj3FqyQ,ee qe browny boi infant highly complicated multicellular organism whic expose oxygen nt vaccinate moisture
55,antivax,1228733831227826177,./tweet_data/vaccine_2020-02/antivax/tweets3/EQ1W6IlW4AADRe0.jpg,“That’s how *antivaxxing* works” via u/derp_y_ #vaxxhappened #antivax #antivaxx https://t.co/W1fn0TyzNo,give essential oil broken bone terminal disease oo se
56,antivax,1229179157990584327,./tweet_data/vaccine_2020-02/antivax/tweets3/EQ7r7j2XYAAfy5-.jpg,“This is probably gonna get deleted.” via u/Tristan_Dean_Foss #vaxxhappened #antivax #antivaxx https://t.co/XEouIYlqiU,antivaxxer find 2696 chance choke food ve gue age
57,antivax,1228763116214706177,./tweet_data/vaccine_2020-02/antivax/tweets3/EQ1xiktVAAAOfFK.jpg,"@dungeekin Correct, @dungeekin... #BIOLOGICWEAPON #antivax #antivaxxers #antivaxx #measles #mumps #VaccinesWork #vaccines #vaccination #VaccinesSaveLives #vaccinateyourkida #SaturdayThoughts #SaturdayMotivation #SaturdaySocial https://t.co/PR9OzSmdEG",unvaccinated kid biological warfare vector threat national security think coincidence russia push propaganda think
58,antivax,1228859468550754304,./tweet_data/vaccine_2020-02/antivax/tweets3/EQ3JK_hUwAIr3yp.jpg,Just a little food for thought... #antivax https://t.co/FC4IxB4Hrx,dear antivaxxer chance china prove wrong sae
59,antivax,1228477133699375105,./tweet_data/vaccine_2020-02/antivax/tweets3/EQxtcXLWkAALw28.jpg,“Got my Flu Shot and Meningitis Vaccine today!!” via u/cathartman15 #vaxxhappened #antivax #antivaxx https://t.co/F8UyLoVoIn,flu shot meningitis vaccine ey oe vaccines necessary
60,antivax,1228575241972088832,./tweet_data/vaccine_2020-02/antivax/tweets3/EQzGrAvWsAEPQQP.jpg,“Why?” via u/DM_ME_YOUR_PASSWORD #vaxxhappened #antivax #antivaxx https://t.co/AAry5RpyCS,es paper ny ah yx 2261 like
61,antivax,1228651035167580160,./tweet_data/vaccine_2020-02/antivax/tweets3/EQ0LmWuUEAUCqk8.jpg,"Dear Antivaxxers,

As attached.

Thanks

#antivaxxers #antivax https://t.co/fjohPv2zAv",dear antivaxxer chance china prove ined
62,antivax,1233060619789783047,./tweet_data/vaccine_2020-02/antivax/tweets4/ERy2GXZXsAMIBdI.jpg,“Sounds about right!” via u/throwaway12222222228 #vaxxhappened #antivax #antivaxx https://t.co/iNSHglqu4B,ask anti vax parent have kid esa oa aed rt
63,antivax,1232813699360055296,./tweet_data/vaccine_2020-02/antivax/tweets4/ERvVhj7WoAEqIDx.jpg,@GwynethPaltrow is right. #antivaxxersareidiots #Memes #reddit #antivax #abdu #AndThenIGotThrownOut #DonaldTrump #JustinBieber #AshWednesday #CoronavirusOutbreak #COVIDー19 #coronavirususa #DelhiBurns #كلام_القرني_والمغامسي_يمثلني #DelhiRiots2020 #CoronaVirusUpdates https://t.co/lb9qrcfC3Y,actually prove vaccinate kid likely autism one thal nt vaccinate dead oo
64,antivax,1233022840196214784,./tweet_data/vaccine_2020-02/antivax/tweets4/ERyTvTmXYAIHaGE.jpg,“She’s an antivaxxer btw. This is how they get their “data”” via u/anoobsearcher #vaxxhappened #antivax #antivaxx https://t.co/YFha9vdfjQ,te catie believe bill gates coronavirus 16 321 vote final result 755 pm twitter android 19 retweets 30 like td
65,antivax,1232826486798897158,./tweet_data/vaccine_2020-02/antivax/tweets4/ERvhKCSW4AEhVX0.jpg,“Wow such empty in his brain” via u/DiamondRocks22 #vaxxhappened #antivax #antivaxx https://t.co/AIwCWFc4iG,37 mandatory vaccines violate bodily autonomy vote orl mh na ey cr wrong
66,antivax,1233077488965779456,./tweet_data/vaccine_2020-02/antivax/tweets4/ERzFcPjXUAAQJdj.jpg,3/4 #antivax folks are threatening doctors. #stopantivaxviolence https://t.co/bfMd9ZsJon,pharma puppet doctor sara hippocratic oath breaker lobby aap healthy medically fragile child sanctity relationship ah ro
67,antivax,1232960301764665344,./tweet_data/vaccine_2020-02/antivax/tweets4/ERxaVw2WoAAWWwJ.jpg,The most important cause of autism is vaccines. Polio has appeared after vaccinations. Protect your kids from charlatans. #antivax #antivaxx #advocate #hospital #kids https://t.co/KBYyxqI8Q1,nn red pine psychiatry post advocate vaccine cause yv victim thd mother gre ae gre sy ae oe
68,antivax,1232356395145715714,./tweet_data/vaccine_2020-02/antivax/tweets4/ERo1nGrXUAA4xqI.jpg,“A kind Reddit stranger sent me this and I love it” via u/LongjumpingTraffic7 #vaxxhappened #antivax #antivaxx https://t.co/aJGaKdwSH0,vaccines cause autism
69,antivax,1232545172589809664,./tweet_data/vaccine_2020-02/antivax/tweets4/ERrhTXiWAAUKxuW.png,"“No, I'm not afraid of you. I fear for those who cannot be vaccinated for legitimate medical reasons. They are at risk because of your parents idiotic choice.” via u/Tenebra99 #vaxxhappened #antivax #antivaxx https://t.co/fkkBjE91cP",afraid se mean vaccines dont
70,antivax,1232197900702289926,./tweet_data/vaccine_2020-02/antivax/tweets4/ERmldgOXYAAPYvZ.png,"“I do not make fun of mothers of vaccine injured children. But when you claim ANY issue your child may have is a vaccine injury, sorry, but that is ridiculous.” via u/Tenebra99 #vaxxhappened #antivax #antivaxx https://t.co/CajygUeiAB",ss mother injured children
71,antivax,1231733700536283142,./tweet_data/vaccine_2020-02/antivax/tweets4/ERf_ROuXsAEtSzu.jpg,"""Some parents say they'll leave the state.""

👋🏻

#antivax #VaccinesWork #VaccinesSaveLives https://t.co/sdpjl5AnAH https://t.co/vZKOmx37BR",bonus point act like
72,antivax,1231835521170669569,./tweet_data/vaccine_2020-02/antivax/tweets4/ERhb4L5XUAIX1DH.png,“We have a problem.” via u/Tenebra99 #vaxxhappened #antivax #antivaxx https://t.co/3HHSd52jbj,boman ct oem cea ely std finally progress yew blea soa ul eer onethird parent delay give vaccine col eh
73,antivax,1231262593395908608,./tweet_data/vaccine_2020-02/antivax/tweets4/ERZSwjqW4AAljy4.jpg,"People adopt views of people who are like them and those whom they admire- wrapped in group identity, believing in a more natural way towards a more aspirational lifestyle, sometimes through personal anecdotes.
Dr. Linda Fu, @ChildrensNatl #antivax  #misinfocon #science https://t.co/ihPngNmJl5",rag biel come activist join robert kennedy dp vaccination bal ge ny oi aa ie ea te ne aas
74,antivax,1231348499704373248,./tweet_data/vaccine_2020-02/antivax/tweets4/ERag73JXsAUvhMx.jpg,“Rocking different hairstyles” via u/darth_batman73 #vaxxhappened #antivax #antivaxx https://t.co/isFNmSWdhY,di mom ey law ae cy uncle granny vs rege lg v4 a4
75,antivax,1231646710281183233,./tweet_data/vaccine_2020-02/antivax/tweets4/ERewKAZWkAAZEta.jpg,“The antivaxx posts are inevitable...” via u/colander_head #vaxxhappened #antivax #antivaxx https://t.co/MpG8HvNc2U,fear co te wap oe 2d wary ao
76,antivax,1231707090068090886,./tweet_data/vaccine_2020-02/antivax/tweets4/ERfnEjhXYAE7zgr.jpg,“At a Mardi Gras parade in Biloxi when I caught these guys in the wild” via u/resideve #vaxxhappened #antivax #antivaxx https://t.co/ifbmo7krNA,tn ote vaccines mad ap sfe fetal cell este day ee ht je eee
77,antivaxx,1225469104657707014,./tweet_data/vaccine_2020-02/antivaxx/tweets1/EQG9pisXkAARkq9.jpg,"Smh can’t fix stupid.#
#JustSayNoToVaccines #AntiVaxxMovement #AntiVaxx https://t.co/2at0Koh87C",ae symbol movement etd
78,antivaxx,1223841731872993281,./tweet_data/vaccine_2020-02/antivaxx/tweets1/EPv1ijeXUAAlotW.png,"heck you mom

#VaccinesWork #antivaxx #antivaxxers #antivaxxersaredumb https://t.co/AJGL1Xx4h0",vi kon eh cd d3 big pharma big greed fie es se ws oo cp
79,antivaxx,1227922385317310466,./tweet_data/vaccine_2020-02/antivaxx/tweets2/EQp05iNWkAAD-PK.jpg,"Dang, Spidey #CoronavirusOutbreak #antivaxx https://t.co/gKHvqfXw8I",dear antivaxxer chance china prove wrong amb
80,antivaxx,1227825348278181889,./tweet_data/vaccine_2020-02/antivaxx/tweets2/EQocm2SX0AAoqC6.jpg,"Dear Anti-Vaxxers:
Now is your chance to go to China and prove us all wrong.
#antivaxxers #antivaxx https://t.co/qOG6IP3XV5",dear antivaxxer chance china prove wrong ti
81,antivaxx,1227984944602976257,./tweet_data/vaccine_2020-02/antivaxx/tweets2/EQqtzHJXYAAfUcE.jpg,"Change my mind
#coronavairus #corona #china #meme #antivaxx https://t.co/ORBCTs2JoU",dear antivaxxer chance china prove eal ti
82,antivaxx,1227728580160811008,./tweet_data/vaccine_2020-02/antivaxx/tweets2/EQnEoo2U4AAZ5cH.jpg,Here you go dumbasses... it’s your chance to prove everyone wrong! #antivaxx #trump2020 #jesussays #conservative #AmericaFirst #jesus https://t.co/Z7EAEdYT7V,vv dear antivaxxer chance china prove wrong ul
83,antivaxx,1227863446890459137,./tweet_data/vaccine_2020-02/antivaxx/tweets2/EQo_SyGX0AImNSQ.jpg,"Mannn I saw this and thought, yeah why don’t you? I know it’s not the time to be joking about the #coronavirus but bloody hell the #antivaxx crew just do not stop with their holy kangen water and breathing three times every 5 minutes 🥴🙄 https://t.co/3dPiUtps4a",dear antivaxxer chance china prove wrong yi ee
84,antivaxx,1228026425715892224,./tweet_data/vaccine_2020-02/antivaxx/tweets2/EQrTaeZXUAEEbbH.jpg,Next weekend I'm pretty sure I'm going to upset some people.... #antivaxx @SciManDan https://t.co/bTAds4ZcNQ,alf ore te yt ue ae bes bv theyre hick ww
85,antivaxx,1226566608409309184,./tweet_data/vaccine_2020-02/antivaxx/tweets2/EQWj04UXsAo9vhi.jpg,"#vaccination #VaccinesWork #antivaxx

Dear #antivaxxers, Meet #DrDonaldHenderson. Slayer of #smallpox https://t.co/52CzneOUAz",pop star actor die 2016 eradicate smallpox kill 500 million 20th century 524 pm
86,antivaxx,1227014883188842496,./tweet_data/vaccine_2020-02/antivaxx/tweets2/EQc7h9BXkAA30Hd.jpg,TRUE!!! #antivaxx https://t.co/60wHIbVlCa,em pic lam mle aim uh man live turn fine net
87,antivaxx,1229353591053443073,./tweet_data/vaccine_2020-02/antivaxx/tweets3/EQ-KkviWkAAoT2W.jpg,#antivaxx you got a chance tho😤 go get it 💯 https://t.co/V1zO1g7Xp4,dear antivaxxer chance china prove wrong uf
88,antivaxx,1229253130912550913,./tweet_data/vaccine_2020-02/antivaxx/tweets3/EQ8vM02VAAE_qgv.jpg,"Dear #antivaxx people, listen to Prof. #SpiderMan , this is your chance to turn the world's perception upside down by putting your money where your mouth is (so to speak).
#vaccines #JustSaying https://t.co/7gA8ThoaOS",dear antivaxxer chance china prove wrong ti
89,antivaxx,1229419868396621824,./tweet_data/vaccine_2020-02/antivaxx/tweets3/EQ_G2c7XkAI-a_8.jpg,"Please anti-vaxxers... prove us all wrong. Go to China.
#coronavavirus #antivaxx #antivaxxers #autismacceptance https://t.co/iQshn4glgE",dear antivaxxer chance china prove tele ti
90,antivaxx,1228511339125014528,./tweet_data/vaccine_2020-02/antivaxx/tweets3/EQyMjP0WsAEH1Er.jpg,@ChelseaClinton Alternate advice for the #antivaxx crowd and Jim Bakker. #coronavirus https://t.co/T0FFhQALbw,dear antivaxxer chance china prove wrong uf
91,antivaxx,1228817287215550464,./tweet_data/vaccine_2020-02/antivaxx/tweets3/EQ2izr-WAAEOMPF.jpg,"Do it!

#antivaxx 
#antivaxxers 
#dumbasses
#vacinateyourfuckingkids https://t.co/ZUxPaWiykO",dear antivaxxer chance china prove wrong ul
